{
  "schemaVersion": 1,
  "updatedAt": "2026-10-11T06:38:48.527Z",
  "updatedBy": "Simon",
  "zones": [
    {
      "id": "z1",
      "nom": "Ma cave",
      "rows": 7,
      "cols": 12,
      "rowLabels": [
        "A",
        "B",
        "C",
        "D",
        "E",
        "F",
        "G"
      ],
      "disabledSlots": [],
      "couleur": "#8E2438",
      "ordre": 1
    }
  ],
  "wines": [
    {
      "id": "w_1",
      "ref": 1,
      "producteur": "Domaine Gantenbein",
      "nom": "Pinot Noir",
      "pays": "CH",
      "region": "Grisons",
      "appellation": "Graubünden AOC",
      "appellationId": null,
      "sousRegion": "Bündner Herrschaft",
      "couleur": "Rouge",
      "millesime": 2019,
      "cepages": [
        "Pinot Noir"
      ],
      "cepageIds": [
        "pinot-noir"
      ],
      "prixReference": 65,
      "valeur": 90,
      "gardeDe": 2024,
      "gardeA": 2041,
      "apogee": 2031,
      "gardeSource": "auto",
      "gardeExplication": "Cépage Pinot Noir (vin de garde), relevé d'un cran (prix 65 CHF) + millésime 2019 — appellation inconnue du référentiel",
      "mets": [
        "volaille_rotie",
        "champignons",
        "viandes_blanches",
        "charcuterie",
        "fromages_pate_molle"
      ],
      "metsSource": "auto",
      "note": null,
      "commentaire": null,
      "archive": false
    },
    {
      "id": "w_2",
      "ref": 2,
      "producteur": "Marie-Thérèse Chappaz",
      "nom": "Fendant de Fully",
      "pays": "CH",
      "region": "Valais",
      "appellation": "Fendant",
      "appellationId": "ch-valais-fendant",
      "sousRegion": "Fully",
      "couleur": "Blanc",
      "millesime": 2024,
      "cepages": [
        "Chasselas"
      ],
      "cepageIds": [
        "chasselas"
      ],
      "prixReference": 22,
      "valeur": 22,
      "gardeDe": 2025,
      "gardeA": 2028,
      "apogee": 2026,
      "gardeSource": "auto",
      "gardeExplication": "Appellation Fendant (garde courte) + millésime 2024",
      "mets": [
        "fondue",
        "raclette",
        "aperitif",
        "cuisine_alpine",
        "poissons_delicats",
        "fromages_pate_dure"
      ],
      "metsSource": "auto",
      "note": null,
      "commentaire": "Sur la fondue de samedi.",
      "archive": false
    },
    {
      "id": "w_3",
      "ref": 3,
      "producteur": "Château de Lamarque",
      "nom": "",
      "pays": "FR",
      "region": "Bordeaux",
      "appellation": "Haut-Médoc",
      "appellationId": "fr-haut-medoc",
      "sousRegion": "Médoc",
      "couleur": "Rouge",
      "millesime": 2018,
      "cepages": [
        "Cabernet Sauvignon",
        "Merlot",
        "Cabernet Franc",
        "Petit Verdot"
      ],
      "cepageIds": [
        "cabernet-sauvignon",
        "merlot",
        "cabernet-franc"
      ],
      "prixReference": 26,
      "valeur": 26,
      "gardeDe": 2021,
      "gardeA": 2030,
      "apogee": 2025,
      "gardeSource": "auto",
      "gardeExplication": "Appellation Haut-Médoc (vin de garde) + millésime 2018",
      "mets": [
        "viandes_rouges_grillees",
        "agneau",
        "viandes_rouges_mijotees",
        "gibier",
        "fromages_pate_dure"
      ],
      "metsSource": "auto",
      "note": null,
      "commentaire": null,
      "archive": false
    },
    {
      "nom": "Les 3 Villages",
      "region": "Rhône",
      "appellation": "Ventoux AOP",
      "appellationId": "fr-ventoux",
      "sousRegion": "Sud",
      "millesime": 2022,
      "cepages": [],
      "cepageIds": [],
      "cepageDominantInconnu": false,
      "prixReference": 10.75,
      "valeur": 10.75,
      "gardeDe": 2023,
      "gardeA": 2026,
      "apogee": 2024,
      "gardeExplication": "Appellation Ventoux (garde moyenne), abaissé d'un cran (prix 10.75 CHF) + millésime 2022",
      "mets": [],
      "note": null,
      "commentaire": null,
      "archive": false,
      "producteur": "Château La Croix des Pins",
      "pays": "FR",
      "couleur": "Rouge",
      "gardeSource": "auto",
      "metsSource": "auto",
      "id": "w_4",
      "ref": 4
    },
    {
      "nom": "Dahu Noir",
      "region": "Suisse",
      "appellation": "Vin de Pays Suisse",
      "appellationId": "ch-vdp-suisse-rouge",
      "sousRegion": null,
      "millesime": 2022,
      "cepages": [],
      "cepageIds": [],
      "cepageDominantInconnu": false,
      "prixReference": 15.5,
      "valeur": 15.5,
      "gardeDe": 2023,
      "gardeA": 2026,
      "apogee": 2024,
      "gardeExplication": "Couleur Rouge (garde moyenne), abaissé d'un cran (prix 15.5 CHF) + millésime 2022 — appellation Vin de Pays Suisse, trop large pour fixer une garde, et cépage inconnu du référentiel",
      "mets": [],
      "note": null,
      "commentaire": null,
      "archive": false,
      "producteur": "Les Celliers de Sion",
      "pays": "CH",
      "couleur": "Rouge",
      "gardeSource": "auto",
      "metsSource": "auto",
      "id": "w_5",
      "ref": 5
    },
    {
      "nom": "Le Terre",
      "region": "Piémont",
      "appellation": "Barolo DOCG",
      "appellationId": "it-barolo",
      "sousRegion": "Langhe",
      "millesime": 2019,
      "cepages": [
        "Nebbiolo"
      ],
      "cepageIds": [
        "nebbiolo"
      ],
      "cepageDominantInconnu": false,
      "prixReference": 48,
      "valeur": 48,
      "gardeDe": 2024,
      "gardeA": 2041,
      "apogee": 2031,
      "gardeExplication": "Appellation Barolo (grande garde) + millésime 2019",
      "mets": [
        "gibier",
        "viandes_rouges_mijotees",
        "truffe",
        "fromages_pate_dure",
        "champignons",
        "risotto"
      ],
      "note": null,
      "commentaire": null,
      "archive": false,
      "producteur": "Terre del Barolo",
      "pays": "IT",
      "couleur": "Rouge",
      "gardeSource": "auto",
      "metsSource": "auto",
      "id": "w_6",
      "ref": 6
    },
    {
      "nom": "Cornalin",
      "region": "Valais",
      "appellation": "AOC Valais",
      "appellationId": "ch-valais-rouge",
      "sousRegion": null,
      "millesime": 2022,
      "cepages": [
        "Cornalin"
      ],
      "cepageIds": [
        "cornalin"
      ],
      "cepageDominantInconnu": false,
      "prixReference": 14.95,
      "valeur": 14.95,
      "gardeDe": 2024,
      "gardeA": 2028,
      "apogee": 2025,
      "gardeExplication": "Cépage Cornalin (vin de garde), abaissé d'un cran (prix 14.95 CHF) + millésime 2022 — appellation Valais, trop large pour fixer une garde",
      "mets": [
        "viandes_rouges_grillees",
        "viandes_rouges_mijotees",
        "gibier",
        "agneau",
        "fromages_pate_dure"
      ],
      "note": null,
      "commentaire": null,
      "archive": false,
      "producteur": "Frédéric Dumoulin",
      "pays": "CH",
      "couleur": "Rouge",
      "gardeSource": "auto",
      "metsSource": "auto",
      "id": "w_7",
      "ref": 7
    },
    {
      "nom": "Emma",
      "region": "Languedoc-Roussillon",
      "appellation": "Minervois AOP",
      "appellationId": "fr-minervois",
      "sousRegion": "Languedoc",
      "millesime": 2022,
      "cepages": [
        "Syrah",
        "Carignan",
        "Mourvèdre"
      ],
      "cepageIds": [
        "syrah",
        "carignan",
        "mourvedre"
      ],
      "cepageDominantInconnu": false,
      "prixReference": 9.3,
      "valeur": 9.3,
      "gardeDe": 2023,
      "gardeA": 2026,
      "apogee": 2024,
      "gardeExplication": "Appellation Minervois (garde moyenne), abaissé d'un cran (prix 9.3 CHF) + millésime 2022",
      "mets": [
        "viandes_rouges_grillees",
        "gibier",
        "barbecue",
        "agneau",
        "viandes_rouges_mijotees"
      ],
      "note": null,
      "commentaire": null,
      "archive": false,
      "producteur": "Domaine Lignères & Lathenay",
      "pays": "FR",
      "couleur": "Rouge",
      "gardeSource": "auto",
      "metsSource": "auto",
      "id": "w_8",
      "ref": 8
    },
    {
      "nom": "L'AS de Cœur — Assemblage",
      "region": "Vaud",
      "appellation": "Côtes de l'Orbe AOC",
      "appellationId": "ch-vaud-cotes-de-lorbe-rouge",
      "sousRegion": "Côtes de l'Orbe",
      "millesime": 2021,
      "cepages": [
        "Gamaret",
        "Garanoir",
        "Pinot Noir",
        "Gamay"
      ],
      "cepageIds": [
        "gamaret",
        "garanoir",
        "pinot-noir",
        "gamay"
      ],
      "cepageDominantInconnu": false,
      "prixReference": 14,
      "valeur": 14,
      "gardeDe": 2023,
      "gardeA": 2027,
      "apogee": 2024,
      "gardeExplication": "Cépage Gamaret (vin de garde), abaissé d'un cran (prix 14 CHF) + millésime 2021 — appellation Côtes de l'Orbe, trop large pour fixer une garde",
      "mets": [
        "viandes_rouges_grillees",
        "viandes_rouges_mijotees",
        "gibier",
        "barbecue",
        "fromages_pate_dure"
      ],
      "note": null,
      "commentaire": "Producteur identifié en ligne (Cave de Jolimont, Mont-sur-Rolle) ; illisible sur la photo de contre-étiquette.",
      "archive": false,
      "producteur": "Cave de Jolimont",
      "pays": "CH",
      "couleur": "Rouge",
      "gardeSource": "auto",
      "metsSource": "auto",
      "id": "w_9",
      "ref": 9
    },
    {
      "nom": "Villa Carena — Il Grande",
      "region": "Piémont",
      "appellation": "Monferrato Rosso DOC",
      "appellationId": "it-monferrato",
      "sousRegion": null,
      "millesime": 2014,
      "cepages": [
        "Barbera",
        "Cabernet Sauvignon"
      ],
      "cepageIds": [
        "barbera",
        "cabernet-sauvignon"
      ],
      "cepageDominantInconnu": false,
      "prixReference": 24.5,
      "valeur": 24.5,
      "gardeDe": 2016,
      "gardeA": 2020,
      "apogee": 2017,
      "gardeExplication": "Appellation Monferrato (garde moyenne) + millésime 2014",
      "mets": [
        "pates_tomate",
        "charcuterie",